13:04:38.627897 IP 192.168.1.4.60581 > 192.168.1.4.10002: Flags [S], seq 2610021162, win 65535, options [mss 16344,nop,wscale 6,nop,nop,TS val 771502563 ecr 0,sackOK,eol], length 0
E..@..@.@.............'....*..............?........
-.1.........
13:04:38.628003 IP 192.168.1.4.10002 > 192.168.1.4.60581: Flags [S.], seq 3579251883, ack 2610021163, win 65535, options [mss 16344,nop,wscale 6,nop,nop,TS val 771502563 ecr 771502563,sackOK,eol], length 0
E..@..@.@...........'....W.....+..........?........
-.1.-.1.....
13:04:38.628017 IP 192.168.1.4.60581 > 192.168.1.4.10002: Flags [.], ack 1, win 6379, options [nop,nop,TS val 771502563 ecr 771502563], length 0
E..4..@.@.............'....+.W.............
-.1.-.1.
13:04:38.628027 IP 192.168.1.4.10002 > 192.168.1.4.60581: Flags [.], ack 1, win 6379, options [nop,nop,TS val 771502563 ecr 771502563], length 0
E..4..@.@...........'....W.....+...........
-.1.-.1.
13:04:38.628405 IP 192.168.1.4.10002 > 192.168.1.4.60581: Flags [P.], seq 1:16, ack 1, win 6379, options [nop,nop,TS val 771502563 ecr 771502563], length 15
E..C..@.@...........'....W.....+...........
-.1.-.1..............@.
13:04:38.628424 IP 192.168.1.4.60581 > 192.168.1.4.10002: Flags [.], ack 16, win 6379, options [nop,nop,TS val 771502563 ecr 771502563], length 0
E..4..@.@.............'....+.W.............
-.1.-.1.
13:04:38.629046 IP 192.168.1.4.60581 > 192.168.1.4.10002: Flags [P.], seq 1:348, ack 16, win 6379, options [nop,nop,TS val 771502564 ecr 771502563], length 347
E.....@.@.............'....+.W.............
-.1.-.1.PRI * HTTP/2.0

SM

...................................................D.a%BWBm..%~._rm..%...B...J.A...\.<.Wj.@....!.IjJ..Y...u.b.&=LMed.u.t...M......Q.!.......RB.@._.#...te.M.5.....!.IjJ....?.8.....a.Z...t&.....jJ.........Z..*/*.. .9V!.M......d......M#.d..j.u.:...b.&.j8.Z0.*..r..........Z..j!.5S......RB.@._.#...!......O..@.................V
13:04:38.629063 IP 192.168.1.4.10002 > 192.168.1.4.60581: Flags [.], ack 348, win 6374, options [nop,nop,TS val 771502564 ecr 771502564], length 0
E..4..@.@...........'....W.................
-.1.-.1.
13:04:38.629670 IP 192.168.1.4.10002 > 192.168.1.4.60581: Flags [P.], seq 16:25, ack 348, win 6374, options [nop,nop,TS val 771502564 ecr 771502564], length 9
E..=..@.@...........'....W.................
-.1.-.1..........
13:04:38.629686 IP 192.168.1.4.60581 > 192.168.1.4.10002: Flags [.], ack 25, win 6379, options [nop,nop,TS val 771502564 ecr 771502564], length 0
E..4..@.@.............'......W.............
-.1.-.1.
13:04:38.630091 IP 192.168.1.4.10002 > 192.168.1.4.60581: Flags [P.], seq 25:150, ack 348, win 6374, options [nop,nop,TS val 771502565 ecr 771502564], length 125
E.....@.@...........'....W.................
-.1.-.1...........................	............ .....u.b.&=LMed.u.t.................V..12345667890.
................4...0......%B.1..
13:04:38.630108 IP 192.168.1.4.60581 > 192.168.1.4.10002: Flags [.], ack 150, win 6377, options [nop,nop,TS val 771502565 ecr 771502565], length 0
E..4..@.@.............'......W.A...........
-.1.-.1.
13:04:38.630183 IP 192.168.1.4.60581 > 192.168.1.4.10002: Flags [P.], seq 348:357, ack 150, win 6377, options [nop,nop,TS val 771502565 ecr 771502565], length 9
E..=..@.@.............'......W.A...........
-.1.-.1..........
13:04:38.630195 IP 192.168.1.4.10002 > 192.168.1.4.60581: Flags [.], ack 357, win 6374, options [nop,nop,TS val 771502565 ecr 771502565], length 0
E..4..@.@...........'....W.A...............
-.1.-.1.
13:04:38.634216 IP 192.168.1.4.60581 > 192.168.1.4.10002: Flags [P.], seq 357:374, ack 150, win 6377, options [nop,nop,TS val 771502568 ecr 771502565], length 17
E..E..@.@.............'......W.A...........
-.1.-.1..............	...
13:04:38.634241 IP 192.168.1.4.10002 > 192.168.1.4.60581: Flags [.], ack 374, win 6373, options [nop,nop,TS val 771502568 ecr 771502568], length 0
E..4..@.@...........'....W.A...............
-.1.-.1.
13:04:38.634268 IP 192.168.1.4.60581 > 192.168.1.4.10002: Flags [F.], seq 374, ack 150, win 6377, options [nop,nop,TS val 771502568 ecr 771502568], length 0
E..4..@.@.............'......W.A...........
-.1.-.1.
13:04:38.634281 IP 192.168.1.4.10002 > 192.168.1.4.60581: Flags [.], ack 375, win 6373, options [nop,nop,TS val 771502568 ecr 771502568], length 0
E..4..@.@...........'....W.A...............
-.1.-.1.
13:04:38.634420 IP 192.168.1.4.10002 > 192.168.1.4.60581: Flags [F.], seq 150, ack 375, win 6373, options [nop,nop,TS val 771502568 ecr 771502568], length 0
E..4..@.@...........'....W.A...............
-.1.-.1.
13:04:38.634443 IP 192.168.1.4.60581 > 192.168.1.4.10002: Flags [.], ack 151, win 6377, options [nop,nop,TS val 771502568 ecr 771502568], length 0
E..4..@.@.............'......W.B...........
-.1.-.1.