14:29:10.973603 IP 127.0.0.1.51248 > 127.0.0.1.10002: Flags [S], seq 1241176497, win 65535, options [mss 16344,nop,wscale 6,nop,nop,TS val 776435771 ecr 0,sackOK,eol], length 0
E..@..@.@............0'.I............4....?........
.Gx;........
14:29:10.973677 IP 127.0.0.1.10002 > 127.0.0.1.51248: Flags [S.], seq 901673863, ack 1241176498, win 65535, options [mss 16344,nop,wscale 6,nop,nop,TS val 776435771 ecr 776435771,sackOK,eol], length 0
E..@..@.@...........'..05.s.I........4....?........
.Gx;.Gx;....
14:29:10.973688 IP 127.0.0.1.51248 > 127.0.0.1.10002: Flags [.], ack 1, win 6379, options [nop,nop,TS val 776435771 ecr 776435771], length 0
E..4..@.@............0'.I...5.s......(.....
.Gx;.Gx;
14:29:10.973698 IP 127.0.0.1.10002 > 127.0.0.1.51248: Flags [.], ack 1, win 6379, options [nop,nop,TS val 776435771 ecr 776435771], length 0
E..4..@.@...........'..05.s.I........(.....
.Gx;.Gx;
14:29:10.973834 IP 127.0.0.1.51248 > 127.0.0.1.10002: Flags [P.], seq 1:25, ack 1, win 6379, options [nop,nop,TS val 776435771 ecr 776435771], length 24
E..L..@.@............0'.I...5.s......@.....
.Gx;.Gx;PRI * HTTP/2.0

SM


14:29:10.973850 IP 127.0.0.1.10002 > 127.0.0.1.51248: Flags [.], ack 25, win 6379, options [nop,nop,TS val 776435771 ecr 776435771], length 0
E..4..@.@...........'..05.s.I........(.....
.Gx;.Gx;
14:29:10.973853 IP 127.0.0.1.51248 > 127.0.0.1.10002: Flags [P.], seq 25:34, ack 1, win 6379, options [nop,nop,TS val 776435771 ecr 776435771], length 9
E..=..@.@............0'.I...5.s......1.....
.Gx;.Gx;.........
14:29:10.973861 IP 127.0.0.1.10002 > 127.0.0.1.51248: Flags [.], ack 34, win 6379, options [nop,nop,TS val 776435771 ecr 776435771], length 0
E..4..@.@...........'..05.s.I........(.....
.Gx;.Gx;
14:29:10.974156 IP 127.0.0.1.10002 > 127.0.0.1.51248: Flags [P.], seq 1:16, ack 34, win 6379, options [nop,nop,TS val 776435771 ecr 776435771], length 15
E..C..@.@...........'..05.s.I........7.....
.Gx;.Gx;.............@.
14:29:10.974177 IP 127.0.0.1.51248 > 127.0.0.1.10002: Flags [.], ack 16, win 6379, options [nop,nop,TS val 776435771 ecr 776435771], length 0
E..4..@.@............0'.I...5.s......(.....
.Gx;.Gx;
14:29:10.974271 IP 127.0.0.1.10002 > 127.0.0.1.51248: Flags [P.], seq 16:25, ack 34, win 6379, options [nop,nop,TS val 776435771 ecr 776435771], length 9
E..=..@.@...........'..05.s.I........1.....
.Gx;.Gx;.........
14:29:10.974283 IP 127.0.0.1.51248 > 127.0.0.1.10002: Flags [.], ack 25, win 6379, options [nop,nop,TS val 776435771 ecr 776435771], length 0
E..4..@.@............0'.I...5.s......(.....
.Gx;.Gx;
14:29:10.974768 IP 127.0.0.1.51248 > 127.0.0.1.10002: Flags [P.], seq 34:147, ack 25, win 6379, options [nop,nop,TS val 776435772 ecr 776435771], length 113
E.....@.@............0'.I...5.s............
.Gx<.Gx;...........O........E.a%BWBm..%~._rm..%...B...J.A...\..p....._..u.b.&=LMedz......`+...@.te.M.5...................
14:29:10.974786 IP 127.0.0.1.10002 > 127.0.0.1.51248: Flags [.], ack 147, win 6377, options [nop,nop,TS val 776435772 ecr 776435772], length 0
E..4..@.@...........'..05.s.I..D.....(.....
.Gx<.Gx<
14:29:20.708600 IP 127.0.0.1.10002 > 127.0.0.1.51248: Flags [P.], seq 25:55, ack 147, win 6377, options [nop,nop,TS val 776445245 ecr 776435772], length 30
E..R..@.@...........'..05.s.I..D.....F.....
.G.=.Gx<..........................	...
14:29:20.708664 IP 127.0.0.1.51248 > 127.0.0.1.10002: Flags [.], ack 55, win 6378, options [nop,nop,TS val 776445245 ecr 776445245], length 0
E..4..@.@............0'.I..D5.s......(.....
.G.=.G.=
14:29:20.709279 IP 127.0.0.1.51248 > 127.0.0.1.10002: Flags [P.], seq 147:164, ack 55, win 6378, options [nop,nop,TS val 776445245 ecr 776445245], length 17
E..E..@.@............0'.I..D5.s......9.....
.G.=.G.=.............	...
14:29:20.709404 IP 127.0.0.1.10002 > 127.0.0.1.51248: Flags [.], ack 164, win 6377, options [nop,nop,TS val 776445245 ecr 776445245], length 0
E..4..@.@...........'..05.s.I..U.....(.....
.G.=.G.=
14:29:32.452915 IP 127.0.0.1.10002 > 127.0.0.1.51248: Flags [P.], seq 55:142, ack 164, win 6377, options [nop,nop,TS val 776456669 ecr 776445245], length 87
E.....@.@...........'..05.s.I..U...........
.G...G.=.........._..u.b.&=LMed..................12345667890.
.........@......4...0@.....%B.1..
14:29:32.452969 IP 127.0.0.1.51248 > 127.0.0.1.10002: Flags [.], ack 142, win 6377, options [nop,nop,TS val 776456669 ecr 776456669], length 0
E..4..@.@............0'.I..U5.t......(.....
.G...G..
14:29:32.455078 IP 127.0.0.1.51248 > 127.0.0.1.10002: Flags [P.], seq 164:194, ack 142, win 6377, options [nop,nop,TS val 776456671 ecr 776456669], length 30
E..R..@.@............0'.I..U5.t......F.....
.G...G............................	...
14:29:32.455100 IP 127.0.0.1.10002 > 127.0.0.1.51248: Flags [.], ack 194, win 6376, options [nop,nop,TS val 776456671 ecr 776456671], length 0
E..4..@.@...........'..05.t.I..s.....(.....
.G...G..
14:29:32.455344 IP 127.0.0.1.10002 > 127.0.0.1.51248: Flags [P.], seq 142:159, ack 194, win 6376, options [nop,nop,TS val 776456671 ecr 776456671], length 17
E..E..@.@...........'..05.t.I..s.....9.....
.G...G...............	...
14:29:32.455655 IP 127.0.0.1.51248 > 127.0.0.1.10002: Flags [.], ack 159, win 6377, options [nop,nop,TS val 776456671 ecr 776456671], length 0
E..4..@.@............0'.I..s5.t&.....(.....
.G...G..
14:29:32.456154 IP 127.0.0.1.51248 > 127.0.0.1.10002: Flags [R.], seq 194, ack 159, win 6377, length 0
E..(..@.@............0'.I..s5.t&P.......